{
  "cycle_id": "2026-07-06__release-v6.7",
  "sprint_goal": "Eliminate app-wide secondary-text WCAG-AA contrast failures across both dark and light themes and lock the fix into a shared design token, while closing out the full AUD-2026-07-06 governance-hardening backlog (including the 3-cycle-carried `.claude/skills/` write-scope escalation).",
  "backlog_slice_source": "claude/cycles/2026-07-06__release-v6.7/stage4_backlog_slice.md",
  "invoked_utc": "2026-07-06T20:00:00Z",
  "mode": "standard",
  "status": "Running",
  "last_updated_utc": "2026-07-06T20:00:00Z",

  "epics": {
    "EPIC-02": {
      "status": "in_progress",
      "branch": "exec/2026-07-06__release-v6.7/EPIC-02",
      "pr_number": null,
      "pr_status": "none",
      "qa_signed_off": false,
      "qa_evidence_log": "claude/cycles/2026-07-06__release-v6.7/qa_evidence_EPIC-02.md",
      "test_scenarios": [],
      "stories": {
        "ST-04": {
          "title": ".claude/skills/ write-scope authority + commit-check patch (BLG-GOV-167)",
          "classification": "autonomous",
          "status": "done",
          "assigned_to": "engine",
          "github_issue": 919,
          "branch": "exec/2026-07-06__release-v6.7/EPIC-02",
          "commit_sha": "519c5e5c908cdba64201426ad114fb249d2db21e",
          "delegation_record_id": null,
          "blocked_since_utc": null,
          "unblock_criteria": null,
          "completed_utc": "2026-07-06T20:15:00Z",
          "acceptance_verified": true,
          "spec_references": ["claude/system/shared_standards.md", ".claude/skills/commit-check/SKILL.md", "claude/system/prompt_change_log.md", "claude/system/OPERATIONAL_GUIDE.md"],
          "deviations_filed": true,
          "last_completed_substep": "3.1.A.pre-commit",
          "sign_off_record": null,
          "notes": "ESC-CLOSE-20260706-01 unblock path (b) satisfied: shared_standards.md v3.8 new §17 grants Head of Specs Team standing write authority over .claude/skills/**, logged in prompt_change_log.md. Formal escalation-record disposition update (Open->Resolved) is out of this routine's write scope (lives in claude/cycles/2026-07-04__release-v6.6/closure_escalations.md) — flagged for next post-ship closure to apply."
        },
        "ST-05": {
          "title": "Structural guard for 4 append-only governance logs (BLG-GOV-168)",
          "classification": "autonomous",
          "status": "done",
          "assigned_to": "engine",
          "github_issue": 920,
          "branch": "exec/2026-07-06__release-v6.7/EPIC-02",
          "commit_sha": "14a693c769b9b73d7a9799a5c4bbea227b8e2e32",
          "delegation_record_id": null,
          "blocked_since_utc": null,
          "unblock_criteria": null,
          "completed_utc": "2026-07-06T20:45:00Z",
          "acceptance_verified": true,
          "spec_references": ["claude/system/shared_standards.md", "claude/system/release_planning_prompt.md", "claude/system/execution_prompt.md", "claude/system/delivery_verification_prompt.md", "claude/system/OPERATIONAL_GUIDE.md"],
          "deviations_filed": true,
          "last_completed_substep": "3.1.A.pre-commit",
          "sign_off_record": null,
          "notes": "AC-03 verified via direct read of each of the 3 engine write steps (release_planning_prompt.md, execution_prompt.md x2 for execution_escalations.md + delegation_log.md, delivery_verification_prompt.md) after editing — not documentation alone."
        },
        "ST-06": {
          "title": "audit.py SLA — same-session commit requirement (BLG-GOV-169)",
          "classification": "autonomous",
          "status": "done",
          "assigned_to": "engine",
          "github_issue": 921,
          "branch": "exec/2026-07-06__release-v6.7/EPIC-02",
          "commit_sha": null,
          "delegation_record_id": null,
          "blocked_since_utc": null,
          "unblock_criteria": null,
          "completed_utc": "2026-07-06T20:55:00Z",
          "acceptance_verified": true,
          "spec_references": ["claude/audit.py"],
          "deviations_filed": true,
          "last_completed_substep": "3.1.A.pre-commit",
          "sign_off_record": null,
          "notes": "Also corrected a stale filename in the SLA block (audit_report.md -> audit_report_AUD-<date>.md) to match CLAUDE.md §1. Comment/prose-only, no AUDIT_VERSION bump per AC-03 precedent (v6.4 ST-07)."
        },
        "ST-07": {
          "title": "Delivery Verification STEP 6 status-line documentation (BLG-GOV-170)",
          "classification": "autonomous",
          "status": "not_started",
          "assigned_to": "engine",
          "github_issue": 922,
          "branch": "exec/2026-07-06__release-v6.7/EPIC-02",
          "commit_sha": null,
          "delegation_record_id": null,
          "blocked_since_utc": null,
          "unblock_criteria": null,
          "completed_utc": null,
          "acceptance_verified": false,
          "spec_references": ["claude/system/delivery_verification_prompt.md"],
          "deviations_filed": false,
          "last_completed_substep": null,
          "sign_off_record": null,
          "notes": ""
        }
      }
    },
    "EPIC-01": {
      "status": "not_started",
      "branch": "exec/2026-07-06__release-v6.7/EPIC-01",
      "pr_number": null,
      "pr_status": "none",
      "qa_signed_off": false,
      "qa_evidence_log": "claude/cycles/2026-07-06__release-v6.7/qa_evidence_EPIC-01.md",
      "test_scenarios": [],
      "stories": {
        "ST-01": {
          "title": "Dark-theme secondary-text contrast fix (BLG-FE-87)",
          "classification": "delegated_frontend",
          "status": "not_started",
          "assigned_to": "engine",
          "github_issue": 923,
          "branch": "exec/2026-07-06__release-v6.7/EPIC-01",
          "commit_sha": null,
          "delegation_record_id": null,
          "blocked_since_utc": null,
          "unblock_criteria": null,
          "completed_utc": null,
          "acceptance_verified": false,
          "spec_references": ["docs/design/2026-07-06__release-v6.7/secondary-text-contrast/ux_spec.md", "docs/specs/frontend/pages/positions.md", "docs/specs/frontend/pages/dashboard.md", "docs/specs/frontend/pages/reflections.md"],
          "deviations_filed": false,
          "last_completed_substep": null,
          "sign_off_record": null,
          "notes": ""
        },
        "ST-02": {
          "title": "Light-theme secondary-text contrast fix (BLG-FE-88)",
          "classification": "delegated_frontend",
          "status": "not_started",
          "assigned_to": "engine",
          "github_issue": 924,
          "branch": "exec/2026-07-06__release-v6.7/EPIC-01",
          "commit_sha": null,
          "delegation_record_id": null,
          "blocked_since_utc": null,
          "unblock_criteria": null,
          "completed_utc": null,
          "acceptance_verified": false,
          "spec_references": ["docs/design/2026-07-06__release-v6.7/secondary-text-contrast/ux_spec.md", "docs/specs/frontend/pages/positions.md", "docs/specs/frontend/pages/dashboard.md", "docs/specs/frontend/pages/reflections.md"],
          "deviations_filed": false,
          "last_completed_substep": null,
          "sign_off_record": null,
          "notes": ""
        },
        "ST-03": {
          "title": "Shared secondary-text design token (BLG-FE-89)",
          "classification": "autonomous",
          "status": "not_started",
          "assigned_to": "engine",
          "github_issue": 925,
          "branch": "exec/2026-07-06__release-v6.7/EPIC-01",
          "commit_sha": null,
          "delegation_record_id": null,
          "blocked_since_utc": null,
          "unblock_criteria": null,
          "completed_utc": null,
          "acceptance_verified": false,
          "spec_references": ["docs/design/2026-07-06__release-v6.7/secondary-text-contrast/ux_spec.md", "docs/specs/frontend/design_system.md"],
          "deviations_filed": false,
          "last_completed_substep": null,
          "sign_off_record": null,
          "notes": ""
        }
      }
    }
  },

  "blocked_items": [],
  "delegated_items": [],
  "completed_items": [],
  "open_escalations": [],

  "merge_gate": {
    "epics_merged": [],
    "epics_pending": ["EPIC-02", "EPIC-01"],
    "all_merged": false
  },

  "sealed": false,
  "sealed_utc": null
}
