{
  "cycle_id": "2026-07-17__release-v7.4",
  "sprint_goal": "Produce the consolidated v7.4 UI-feature readiness pass — dependency pre-flight (cmdk, react-day-picker), UX specs for the saved-filters empty state and bulk-actions confirmation/undo-window modal, a command-palette keyboard-navigation design review, a Playwright visual-regression baseline scope, a command-palette analytics event schema, and a regression-suite CI tagging scheme — so command palette, custom price alerts, bulk actions, and saved filters/calendar view (BLG-FE-115/116/117/118) can each clear a fresh Design Gate once real design artefacts exist.",
  "backlog_slice_source": "claude/cycles/2026-07-17__release-v7.4/amendments/AMD-20260717-01/amended_backlog_slice.md",
  "invoked_utc": "2026-07-17T14:00:00Z",
  "mode": "standard",
  "status": "Running",
  "last_updated_utc": "2026-07-17T14:00:00Z",

  "epics": {
    "EPIC-01": {
      "status": "in_progress",
      "branch": "exec/2026-07-17__release-v7.4/EPIC-01",
      "pr_number": null,
      "pr_status": "none",
      "qa_signed_off": false,
      "qa_evidence_log": "claude/cycles/2026-07-17__release-v7.4/qa_evidence_EPIC-01.md",
      "test_scenarios": [],
      "stories": {
        "ST-01": {
          "title": "Produce v7.4 readiness pass (dependencies, UX specs, design review, QA/analytics coverage)",
          "classification": "autonomous",
          "status": "in_progress",
          "assigned_to": "engine",
          "github_issue": 1010,
          "branch": "exec/2026-07-17__release-v7.4/EPIC-01",
          "commit_sha": null,
          "delegation_record_id": null,
          "blocked_since_utc": null,
          "unblock_criteria": null,
          "completed_utc": null,
          "acceptance_verified": false,
          "spec_references": ["docs/specs/blg_spec_95_v7_4_ui_readiness_pass.md"],
          "spec_reference_not_applicable": false,
          "spec_reference_not_applicable_reason": null,
          "deviations_filed": false,
          "last_completed_substep": "3.1.A.artefacts_drafted",
          "sign_off_record": null,
          "notes": "Case B (documentation-creation): the consolidated readiness pass IS the governing spec_references artefact. All 7 AC bullets (informal AC-01..AC-07 per sprint_planning_notes.md) addressed in the document. New finding during AC-01 (react-day-picker v8->v9 API break in calendar.js) filed as BLG-FE-122."
        }
      }
    }
  },

  "blocked_items": [],
  "delegated_items": [],
  "completed_items": [],
  "open_escalations": [],

  "merge_gate": {
    "epics_merged": [],
    "epics_pending": ["EPIC-01"],
    "all_merged": false
  },

  "sealed": false,
  "sealed_utc": null
}
