{
  "cycle_id": "2026-06-21__release-v5.1",
  "sprint_goal": "Deliver the SI-05 Phase 1 weekly Telegram digest (combining SI-01 compliance data and SI-03 red flag trends) and clear outstanding governance and QA debt — delivery verification prompt patch, SignalCard Playwright coverage, compliance_summary validation, and staged verification sprint protocol.",
  "backlog_slice_source": "claude/cycles/2026-06-21__release-v5.1/stage4_backlog_slice.md",
  "invoked_utc": "2026-06-21T01:00:00Z",
  "mode": "standard",
  "status": "Running",
  "last_updated_utc": "2026-06-21T02:30:00Z",

  "epics": {
    "EPIC-02": {
      "status": "done",
      "branch": "exec/2026-06-21__release-v5.1/EPIC-02",
      "pr_number": 675,
      "pr_status": "open",
      "qa_signed_off": true,
      "qa_evidence_log": "claude/cycles/2026-06-21__release-v5.1/qa_evidence_EPIC-02.md",
      "test_scenarios": [],
      "stories": {
        "ST-03": {
          "title": "delivery_verification_prompt.md §-1.3 Tier 2: agent-mediated signer format acceptance",
          "classification": "autonomous",
          "status": "done",
          "assigned_to": "engine",
          "github_issue": 671,
          "branch": "exec/2026-06-21__release-v5.1/EPIC-02",
          "commit_sha": "48f821af9fca259fe55c7e847cf63c8ab875edd5",
          "delegation_record_id": null,
          "blocked_since_utc": null,
          "unblock_criteria": null,
          "completed_utc": "2026-06-21T01:30:00Z",
          "acceptance_verified": true,
          "spec_references": ["claude/system/delivery_verification_prompt.md"],
          "deviations_filed": true,
          "last_completed_substep": "sign_off_cleared",
          "sign_off_record": {
            "required_by": "Head of Specs Team",
            "method": "agent_mediated",
            "status": "cleared",
            "findings_applied": [],
            "cleared_utc": "2026-06-21T01:30:00Z"
          },
          "notes": "Governance file patch applied. delivery_verification_prompt.md v2.9→v3.0, OPERATIONAL_GUIDE.md v4.30→v4.31, prompt_change_log.md entries appended. No deviations. Head of Specs Team agent-mediated sign-off cleared."
        }
      }
    },
    "EPIC-03": {
      "status": "done",
      "branch": "exec/2026-06-21__release-v5.1/EPIC-03",
      "pr_number": null,
      "pr_status": "none",
      "qa_signed_off": true,
      "qa_evidence_log": "claude/cycles/2026-06-21__release-v5.1/qa_evidence_EPIC-03.md",
      "test_scenarios": ["tests/e2e/signals-allocation-insufficient.spec.js"],
      "stories": {
        "ST-04": {
          "title": "BLG-FE-61: SignalCard allocation_insufficient badge Playwright E2E coverage",
          "classification": "autonomous",
          "status": "done",
          "assigned_to": "engine",
          "github_issue": 672,
          "branch": "exec/2026-06-21__release-v5.1/EPIC-03",
          "commit_sha": "9497bdfd9f1c76fcd0bb3c9c6eef68a38f98c52b",
          "delegation_record_id": null,
          "blocked_since_utc": null,
          "unblock_criteria": null,
          "completed_utc": "2026-06-21T02:00:00Z",
          "acceptance_verified": true,
          "spec_references": [],
          "deviations_filed": true,
          "last_completed_substep": null,
          "sign_off_record": null,
          "notes": "no prior spec applicable — test scenario authoring per schema exemption. Playwright test created at tests/e2e/signals-allocation-insufficient.spec.js. Covers SC-SIG-AI-01 (badge), SC-SIG-AI-02 (reason text), SC-SIG-AI-03 (visually distinct). No deviations."
        },
        "ST-05": {
          "title": "BLG-QA-43: compliance_summary field population validation",
          "classification": "autonomous",
          "status": "done",
          "assigned_to": "engine",
          "github_issue": 673,
          "branch": "exec/2026-06-21__release-v5.1/EPIC-03",
          "commit_sha": "cbc3ef084e402ae1b26aa73001bcea3d4a12d1b9",
          "delegation_record_id": null,
          "blocked_since_utc": null,
          "unblock_criteria": null,
          "completed_utc": "2026-06-21T02:15:00Z",
          "acceptance_verified": true,
          "spec_references": ["docs/specs/api_contracts/reports_endpoints.md#GET /reports/monthly-pnl"],
          "deviations_filed": true,
          "last_completed_substep": null,
          "sign_off_record": null,
          "notes": "Code review verification complete: backend/services/reports_service.py get_arc5_compliance_summary() confirmed to return all 5 spec fields (period_days, validation_pass_rate, override_count, red_flag_events_count, most_frequent_rule_breach). Data sources correct (pre_entry_validation_log + red_flag_events). AC-01 (staging verification of actual data values vs Arc5ComplianceSection display) deferred — requires staging environment + Infrastructure & Operations Owner sign-off. Staging-only AC acknowledged at sprint planning. No deviations from spec structure."
        },
        "ST-06": {
          "title": "BLG-GOV-89: Staged verification sprint protocol document",
          "classification": "autonomous",
          "status": "done",
          "assigned_to": "engine",
          "github_issue": 674,
          "branch": "exec/2026-06-21__release-v5.1/EPIC-03",
          "commit_sha": "75a5df19e7a3f6c5abbd8cd27d8af48ff21ee12a",
          "delegation_record_id": null,
          "blocked_since_utc": null,
          "unblock_criteria": null,
          "completed_utc": "2026-06-21T02:30:00Z",
          "acceptance_verified": true,
          "spec_references": ["docs/operations/staged_verification_sprint_protocol.md"],
          "deviations_filed": true,
          "last_completed_substep": "sign_off_cleared",
          "sign_off_record": {
            "required_by": "Director of Quality + PMO Lead",
            "method": "agent_mediated",
            "status": "cleared",
            "findings_applied": [],
            "cleared_utc": "2026-06-21T02:30:00Z"
          },
          "delivery_note": "docs/operations/staged_verification_sprint_protocol.md",
          "notes": "Protocol document created covering all 4 AC elements: trigger conditions (§2), batching approach (§3), evidence format (§4), sprint sizing note (§5). DoQ + PMO Lead agent-mediated sign-off cleared. No deviations."
        }
      }
    },
    "EPIC-01": {
      "status": "not_started",
      "branch": "exec/2026-06-21__release-v5.1/EPIC-01",
      "pr_number": null,
      "pr_status": "none",
      "qa_signed_off": false,
      "qa_evidence_log": "claude/cycles/2026-06-21__release-v5.1/qa_evidence_EPIC-01.md",
      "test_scenarios": [],
      "stories": {
        "ST-02": {
          "title": "BLG-SPEC-45: SI-05 financial reporting scope verification",
          "classification": "autonomous",
          "status": "not_started",
          "assigned_to": "engine",
          "github_issue": 670,
          "branch": "exec/2026-06-21__release-v5.1/EPIC-01",
          "commit_sha": null,
          "delegation_record_id": null,
          "blocked_since_utc": null,
          "unblock_criteria": null,
          "completed_utc": null,
          "acceptance_verified": false,
          "spec_references": ["docs/product/decisions/si05-telegram-message-format-spec.md"],
          "deviations_filed": false,
          "last_completed_substep": null,
          "sign_off_record": null,
          "notes": "Must complete before ST-01 seals. FR&R Owner sign-off required."
        },
        "ST-01": {
          "title": "SI-05 Phase 1: Backend service + Telegram weekly digest implementation",
          "classification": "autonomous",
          "status": "not_started",
          "assigned_to": "engine",
          "github_issue": 669,
          "branch": "exec/2026-06-21__release-v5.1/EPIC-01",
          "commit_sha": null,
          "delegation_record_id": null,
          "blocked_since_utc": null,
          "unblock_criteria": null,
          "completed_utc": null,
          "acceptance_verified": false,
          "spec_references": [
            "docs/product/decisions/si05-telegram-message-format-spec.md",
            "docs/specs/api_contracts/arc5_compliance_analytics.md"
          ],
          "deviations_filed": false,
          "last_completed_substep": null,
          "sign_off_record": null,
          "notes": "AC-09 (staging Telegram delivery) staging-only — I&O Owner sign-off required. Depends on ST-02 + EPIC-02 merge. New endpoint + openapi.yaml + test.py + SystemStatus.js + SC-SS-01b all in same commit."
        }
      }
    }
  },

  "blocked_items": [],
  "delegated_items": [],
  "completed_items": ["ST-03", "ST-04", "ST-05", "ST-06"],
  "open_escalations": [],

  "merge_gate": {
    "epics_merged": [],
    "epics_pending": ["EPIC-02", "EPIC-03", "EPIC-01"],
    "all_merged": false
  },

  "sealed": false,
  "sealed_utc": null
}
